21 და გაიგეს მისიანებმა და გამოვიდნენ მის შესაპყრობად, რადგან ამბობდნენ, რომ შეიშალა.
22 და მწიგნობრები, რომლებიც იერუსალიმიდან იყვნენ ჩამოსულნი, ამბობდნენ: ბელზებული არის მასთან და ეშმაკთა მთავრით დევნის ეშმაკებს.
23 და მოუხმო მათ და იგავებით ეუბნებოდა: როგორ შეუძლია სატანას სატანის განდევნა?
24 და თუ სამეფო თავის თავში გაიყოფა, ვერ შეძლებს დგომას ის სამეფო;
25 და თუ სახლი თავის თავში გაიყოფა, ვერ შეძლებს ის სახლი დგომას;
26 და თუ სატანა აღუდგა თავის თავს და გაიყო, ვერ შეძლებს დგომას, არამედ აღსასრული დაუდგა.
27 არავის შეუძლია შესვლა ძლიერის სახლში და მისი ქონების გატაცება, თუ ჯერ ძლიერს არ შეკრავს, და მაშინღა გაძარცვავს მის სახლს.
28 ამინ გეუბნებით თქვენ, რომ ყველაფერი მიეტევებათ ადამიანთა ძეებს, ცოდვა და გმობა, რამდენსაც უნდა გმობდნენ,
29 ხოლო ვინც დაგმობს სულიწმიდას, არა აქვს მიტევება უკუნისამდე, არამედ ღირსია საუკუნო სასჯელისა;
30 რადგან ამბობდნენ: არაწმინდა სული არის მასთან.
- დედისა და ძმების მისვლა იესოსთან სასაუბროდ (მთ.12,46-50; ლკ.8,19-21)
31 და მივიდნენ დედა მისი და ძმები და გარეთ დადგნენ და შეაგზავნეს მასთან და უხმობდნენ მას.
32 და ისხდა მის გარშემო ხალხი და უთხრეს მას: აჰა, დედა შენი და შენი ძმები გარეთ გეძებენ შენ.
33 და მიუგო მათ და უთხრა: ვინ არის დედა ჩემი ან ჩემი ძმები?
34 და გადახედა თავის გარშემო მსხდომთ და უთხრა: აჰა, დედა ჩემი და ჩემი ძმები, —
35 რადგან ვინც აღასრულებს ღვთის ნებას, ის არის ჩემი ძმა და ჩემი და, და დედა ჩემი.
480,4,0,
1 და კვლავ დაიწყო სწავლება ზღვის პირას და შეიკრიბა მასთან უამრავი ხალხი, ისე რომ იგი ავიდა და ჩაჯდა ნავში, ზღვაზე, და მთელი ხალხი ზღვის პირას, მიწაზე იდგა.
- იგავი მთესველზე (მთ.13,3-23; ლკ.8,4-15)
2 და ასწავლიდა მათ იგავებით ბევრს და ეუბნებოდა მათ თავისი სწავლებისას:
3 ისმინეთ: აჰა, გამოვიდა მთესველი დასათესად.
4 და იყო, თესვისას ზოგი დავარდა გზასთან და მივიდნენ ფრინველები და შეჭამეს იგი;
5 და სხვა დავარდა კლდოვანზე, სადაც არ იყო ბევრი მიწა, და მყისვე აღმოცენდა, რადგან არ ჰქონდა მიწას სიღრმე;
6 და მზე რომ ამოვიდა, დაჭკნა და, რადგან არ ჰქონდა ფესვი, გახმა;
7 და სხვა ჩავარდა ეკლებში და ამოვიდა ეკლები და მოაშთო იგი და ნაყოფი ვერ გამოიღო;
8 და სხვა დავარდა კარგ მიწაზე და იძლეოდა ნაყოფს, რომელიც აღმოცენდებოდა და იზრდებოდა, და გამოჰქონდა ერთი ოცდაათად და ერთი – სამოცად და ერთი — ასად;
9 და ეუბნებოდა: ვისაც აქვს ყურები სასმენად, ისმინოს!
10 და როდესაც იყო მარტო, ჰკითხეს მას, ვინც მის გარშემო იყვნენ იმ თორმეტთან ერთად, იგავებზე;
11 და ეუბნებოდა მათ: თქვენთვის მოცემულია საიდუმლო ღვთის სასუფევლისა, ხოლო მათთვის, გარეშეთათვის, ყველაფერი იგავებით ითქმება;
12 ისე რომ, ხედვით ხედავენ და არ ხედავენ და სმენით ისმენენ და არ ესმით, რომ არ მოიქცნენ და არ მიეტეოთ მათ ცოდვები (ეს.6,9-10).
13 და უთხრა მათ: არ იცით ეს იგავი? და როგორ გაიგებთ ყველა იგავს?
- განმარტება იგავისა მთესველზე (მთ.13,18-23; ლკ.8.11-15)
14 მთესველი სიტყვას თესავს.
15 ხოლო ესენი არიან, რომლებიც გზასთან არიან, სადაც ითესება სიტყვა და, როდესაც ისმენენ, მყისვე მოდის სატანა და ართმევს სიტყვას, დათესილს მათ გულში;
16 და ესენი არიან კლდოვანზე დათესილნი, რომლებიც, როდესაც ისმენენ სიტყვას, მყისვე სიხარულით იღებენ
17 და არა აქვთ ფესვი თავის თავში, არამედ დროებითნი არიან; და როცა იქნება გაჭირვება ან დევნა ამ სიტყვის გამო, მყისვე დაბრკოლდებიან;
18 და ესენი არიან ეკლებში დათესილნი, რომლებიც სიტყვას ისმენენ,
19 და ამ სოფლის საზრუნავი და სიმდიდრის საცდური და სხვა გულისთქმები შედიან და აშთობენ სიტყვას და უნაყოფო ხდება;
20 და ესენი არიან კარგ მიწაზე დათესილნი, რომლებიც ისმენენ სიტყვას და იღებენ და გამოაქვთ ნაყოფი: ერთი — ოცდაათად და ერთი — სამოცად და ერთი — ასად.
21 და ეუბნებოდა მათ: განა მოაქვთ სანთელი, რომ საწყაოს ქვეშ დადგან ან სარეცლის ქვეშ? განა სასანთლეზე არ დგამენ?
22 რადგან არ არის საიდუმლო, რომელიც არ გაცხადდება, არც იქნება დაფარული, არამედ მოვა გაცხადებულად.
23 ვისაც აქვს ყურები სასმენად, ისმინოს
24 და ეუბნებოდა მათ: იხილეთ, რაც გესმით რა საწყაოთიც მიუწყავთ, მოგეწყვებათ თქვენ და შეგემატებათ თქვენ, რომლებიც ისმენთ;
25 რადგან ვისაც აქვს, მიეცემა მას და ვისაც არა აქვს, რაც აქვს, წაერთმევა მას.
- ღვთის სასუფევლის საიდუმლო
26 და ეუბნებოდა: ისეა სასუფეველი ღვთისა, კაცი რომ აგდებს თესლს მიწაში
27 და იძინებს და დგება ღამით და დღისით და თესლი აღმოცენდება და იზრდება ისე, რომ არ იცის მან,
28 რადგან მიწას თავისთავად გამოაქვს ნაყოფი: პირველად – ღერო, შემდეგ — თავთავი, შემდეგ სავსე ხორბალი თავთავში;
29 ხოლო როცა დამწიფდება ნაყოფი, მაშინვე გზავნის ნამგალს, რადგან დადგა მკა.
- იგავი მდოგვის მარცვალზე (მთ.13,31-32; ლკ.13,18-19)
30 და ამბობდა: რას ვამსგავსოთ სასუფეველი ღვთისა? რომელი იგავი მივუსადაგოთ მას?
31 როგორც მდოგვის მარცვალი, რომელიც, როცა ითესება მიწაზე, მცირეა ყველა თესლზე, რაც არის ქვეყანაზე,
32 და როდესაც ითესება, ამოდის და ხდება ყველა მხალზე უფრო დიდი და გამოიღებს დიდ რტოებს, ისე რომ შეძლებენ მის ჩრდილქვეშ ცის ფრინველები დაბუდებას.
33 და მრავალი ასეთი იგავით ეუბნებოდა მათ სიტყვას, რამდენადაც შეეძლოთ მოსმენა.
34 და იგავის გარეშე არაფერს ეუბნებოდა მათ, ხოლო თავის მოწაფეებს ცალკე განუმარტავდა ყველაფერს.
35 და უთხრა მათ იმ დღეს, როდესაც მოსაღამოვდა: გავიდეთ გაღმა.
- იესოს მიერ ზღვისა და ქარის დამორჩილება (მთ.8,24–27; ლკ.8,22-25)
36 და გაუშვეს ხალხი და წაიყვანეს იგი, როგორც იყო ნავში, და სხვა ნავებიც, რომლებიც იყო მასთან.
37 და იყო დიდი ქარიშხალი და ტალღები ეხეთქებოდა ნავს ისე, რომ უკვე ივსებოდა ნავი.
38 და თვითონ იყო კიჩოზე და სასთუმალზე ეძინა. და გააღვიძეს იგი და უთხრეს: მოძღვარო, არ გედარდება შენ, რომ ვიღუპებით?
39 და გაიღვიძა და შერისხა ქარი და უთხრა ზღვას: დადუმდი, დაწყნარდი და დაცხრა ქარი და დადგა დიდი მყუდროება.
40 და უთხრა მათ: რატომ შეშინდით? როგორ არა გაქვთ რწმენა?
41 და შეეშინდათ დიდი შიშით და ეუბნებოდნენ ერთმანეთს: ვინ არის ეს, რომ ქარიც და ზღვაც ემორჩილებიან მას?
- გერგესელი (გადარინელი) ეშმაკეულის განკურნება (მთ.8,28-34; ლკ.8,26-39)
480,5,0,
1 და გავიდა ზღვის გაღმა, გერგესელთა მხარეში.
2 და როდესაც გადმოვიდა იგი ნავიდან, მაშინვე მიეგება მას საფლავებიდან კაცი, ვისთანაც იყო არაწმინდა სული,
3 რომელსაც სამყოფელი ჰქონდა საფლავებში, და ჯაჭვებითაც არავის შეეძლო მისი შეკვრა;
4 რადგან იგი მრავალგზის იყო ბორკილებითა და ჯაჭვებით შეკრული და იგლეჯდა ჯაჭვებს და ბორკილებს ამსხვრევდა და არავის შეეძლო მისი მოთოკვა
5 და ყოველთვის, ღამე და დღე საფლავებსა და მთებში იყო და ყვიროდა და იცემდა ქვებს.
6 და როდესაც დაინახა იესო შორიდან, გამოიქცა და თაყვანი სცა მას
7 და შეღაღადა დიდი ხმით და უთხრა: რა გინდა ჩემგან შენ, იესო, ძეო ღვთისა მაღლისაო? გაფიცებ შენ ღმერთს, ნუ მტანჯავ მე. —
8 რადგან ეუბნებოდა მას: გადი, არაწმინდა სულო, მაგ კაცისგან.
9 და ჰკითხა მას: რა არის შენი სახელი? და მიუგო და უთხრა: ლეგიონია ჩემი სახელი, რადგან ბევრნი ვართ.
10 და ევედრებოდა მას ძლიერ, რათა არ განედევნა ისინი იმ მხარიდან.
11 და იყო იქ, მთასთან, ღორების დიდი კოლტი, მძოვარი.
12 და ევედრებოდა მას ყველა ეშმაკი და ეუბნებოდა: გაგვიშვი ჩვენ ღორებთან, რომ მათში შევიდეთ.
13 და უბრძანა მათ და გავიდნენ არაწმინდა სულები და შევიდნენ ღორებში; და გადაეშვა კოლტი კბოდიდან ზღვაში — და იყო დაახლოებით ორი ათასი და შთაინთქა ზღვაში;
14 ხოლო მათი მწყემსები გაიქცნენ და შეატყობინეს ქალაქსა და სოფლებს; და გამოვიდნენ, რათა ენახათ, რა მოხდა.
15 და მივიდნენ იესოსთან და ნახეს ეშმაკეული, რომელთანაც იყო ლეგიონი, იჯდა შემოსილი და გონს მოსული, და შეეშინდათ.
16 და უამბობდნენ მათ, ვინც ნახა, რა შეემთხვათ ეშმაკეულსა და ღორებს.
17 და დაუწყეს ვედრება მას, რომ წასულიყო მათი საზღვრებიდან.
18 და როცა ავიდა იგი ნავში, ევედრებოდა მას, ვინც ადრე ეშმაკეული იყო, რომ მასთან ყოფილიყო.
19 და ნება არ დართო, არამედ უთხრა მას: წადი შენს სახლში, შენიანებთან და შეატყობინე მათ, რაც შენ უფალმა გაგიკეთა და რომ შეგიწყალა შენ.
20 და წავიდა და დაიწყო ქადაგება ათქალაქში იმისა, რაც გაუკეთა მას იესომ, და ყველას უკვირდა.
- იაიროსის გარდაცვლილი ასულის აღდგენა და სისხლმდინარე დედაკაცის განკურნება (მთ.9,18-26; ლკ.8,40-66)
21 და გავიდა იესო ნავით კვლავ გაღმა და შეიკრიბა დიდძალი ხალხი მასთან, და იყო ზღვის პირას.
22 და აჰა, მოვიდა ერთი შესაკრებლის მთავართაგანი, სახელად იაიროსი, და დაინახა იგი და ჩაუვარდა მას ფეხებში
23 და ევედრებოდა მას ძლიერ და ეუბნებოდა: ჩემი ასული კვდება, გთხოვ, მოდი და ხელი დაადე მას, რათა განიკურნოს და იცოცხლოს.
24 და წავიდა იესო მასთან და მიჰყვებოდა მას დიდძალი ხალხი და ავიწროებდნენ მას.
25 და ვიღაც დედაკაცს ჰქონდა სისხლდენა თორმეტი წელი,
26 და ბევრი იტანჯა მრავალი მკურნალისგან და დახარჯა, რაც ჰქონდა, ყველაფერი და არაფერმა არგო, არამედ უფრო უარესად გახდა.
27 და როდესაც გაიგონა იესოს შესახებ, მივიდა მასთან ხალხში, ზურგიდან და შეეხო მის სამოსს,
28 რადგან ამბობდა თავის გულში: მის სამოსსაც რომ შევეხო, განვიკურნები.
29 და როდესაც შეეხო, მყისვე გაუშრა მას სისხლის წყარო და იგრძნო სხეულით, რომ განიკურნა სატკივრისაგან;
30 ხოლო თვით იესომ მყისვე გულისხმაყო თავისგან გასული ძალა, მიბრუნდა ხალხში და თქვა: ვინ შეეხო ჩემს სამოსს?
31 და ეუბნებოდნენ მას მისი მოწაფეები: ხედავ ხალხს, რომელიც გავიწროებს შენ და ამბობ: ვინ შემეხო მე?
32 და მიმოიხედა გარშემო, რომ დაენახა, ვინ გააკეთა ეს;
33 ხოლო დედაკაცი შეშინდა და აკანკალდა; იცოდა, რაც მოხდა, მივიდა და დავარდა მის წინაშე და უთხრა მთელი სიმართლე;
34 ხოლო მან უთხრა მას: ასულო, შენმა რწმენამ გიხსნა შენ; წადი მშვიდობით, განკურნებული ხარ შენი სატკივრისგან.
35 და როდესაც იგი ჯერ კიდევ ამას ამბობდა, მოვიდნენ შესაკრებლის მთავრისგან და უთხრეს: შენი ასული მოკვდა; რაღას აწუხებ მოძღვარს?
36 ხოლო იესომ, როცა გაიგონა ეს სიტყვა, უთხრა შესაკრებლის მთავარს: ნუ გეშინია, მხოლოდ გწამდეს.
37 და არავის დართო ნება, რომ მას გაჰყოლოდა, გარდა პეტრესი და იაკობისა და იოანესი, იაკობის ძმისა.
38 და მივიდა შესაკრებლის მთავრის სახლში და იხილა შფოთი და ტიროდნენ და ყვიროდნენ ძლიერ.
39 და შევიდა და უთხრა მათ: რად შფოთავთ და ტირით? ბავშვი არ მომკვდარა, არამედ სძინავს.
40 და ისინი დასცინოდნენ მას; ხოლო მან გამოყარა ყველა და შეიყვანა მამა ბავშვისა და დედა და თავისთან მყოფნი და შევიდა, სადაც ბავშვი იწვა.
41 და მოჰკიდა ხელი ბავშვს და უთხრა მას: ტალითა, კუმი! – რაც ითარგმნება: გოგონა, შენ გეუბნები, ადექი!
42 და მყისვე ადგა გოგონა და გაიარა, რადგან იყო თორმეტიოდე წლისა, და გაოგნდნენ დიდი გაოგნებით.
43 და უბრძანა მათ მრავალგზის, რათა არავის გაეგო ეს; და უთხრა, რომ მიეცათ მისთვის საჭმელი.
480,6,0,
- იესო ქრისტეს მეორედ უარყოფა ნაზარეთში (მთ.13,54-58)
1 და გამოვიდა იქიდან და მივიდა თავის მამულში და მიჰყვებოდნენ მას მისი მოწაფეები.
2 და იყო შაბათი და დაიწყო სწავლება შესაკრებელში; და მრავალი, ვისაც ესმოდა, განცვიფრებული ამბობდა: საიდან აქვს ამას ეს? და რა სიბრძნეა მოცემული მისთვის და როგორი სასწაულები სრულდება მისი ხელით?
3 განა ეს არ არის ხურო, ძე მარიამისა და ძმა იაკობისა და იოსესი და იუდასი და სიმონისა? და მისი დები ყველანი აქ, ჩვენთან, არ არიან? და ბრკოლდებოდნენ მის მიმართ.
