480,1,0,
1 დასაწყისი სახარებისა იესო ქრისტესი, ძისა ღვთისა.
- იოანე ნათლისმცემლის ქადაგება უდაბნოში (მთ.3,1-12; ლკ.3,1-18; ინ.1,6-8;15-38)
2 როგორც წერია წინასწარმეტყველებთან: აჰა, მე მივავლენ ჩემს ანგელოზს შენი პირის წინაშე, რომელიც გაამზადებს შენს გზას შენ წინაშე (მალ.3,1).
3 ხმა მღაღადებლისა უდაბნოში: გაამზადეთ გზა უფლისა და გამართეთ მისი ბილიკები (ეს 40,3).
4 იყო იოანე და ნათელს სცემდა უდაბნოში და ქადაგებდა სინანულის ნათლისღებას ცოდვათა მისატევებლად.
5 და გადიოდა მასთან ჰურიასტანის მთელი ქვეყანა და ყველა იერუსალიმელი და ნათელს იღებდნენ ყველანი მისგან მდინარე იორდანეში და აღიარებდნენ თავის ცოდვებს.
6 და იყო იოანე შემოსილი აქლემის ბეწვით და ტყავის სარტყელი ჰქონდა მას წელზე და ჭამდა კალიასა და ველურ თაფლს,
7 და ქადაგებდა და ამბობდა: მოდის ჩემზე ძლიერი ჩემ შემდეგ, ვის წინაშეც არა ვარ ღირსი, მოვიდრიკო და გავხსნა მის ხამლთა თასმები.
8 მე ნათელი გეცით თქვენ წყლით, ხოლო იგი ნათელს გცემთ თქვენ სულიწმიდით.
- იესო ქრისტეს ნათლისღება (მთ.3,13-17; ლკ.3,21-22; ინ.1,20-34)
9 და იყო, იმ დღეებში მოვიდა იესო გალილეის ნაზარეთიდან და ნათელი მიიღო იოანესგან იორდანეში.
10 და მყისვე, წყლიდან ამოსვლისას, იხილა ცანი გახსნილნი და სული, როგორც მტრედი, გადმომავალი მასზე.
11 და ხმა იყო ზეციდან: შენ ხარ ძე ჩემი საყვარელი, შენ სათნო ხარ ჩემთვის.
- იესო ქრისტეს გამოცდა უდაბნოში (მთ.4,1-11; ლკ.4,1-13)
12 და მაშინვე გაიყვანა სულმა იგი უდაბნოში.
13 და იყო იქ ორმოცი დღე და გამოიცდებოდა სატანისგან და იყო მხეცებთან და ანგელოზები ემსახურებოდნენ მას.
- იესო ქრისტეს დამკვიდრება კაპერნაუმში (მთ.1,13-17; ლკ.4,31-32)
14 ხოლო იოანეს შეპყრობის შემდეგ მივიდა იესო გალილეაში და ქადაგებდა სახარებას ღვთის სასუფევლისას
15 და ამბობდა: აღსრულდა ჟამი და მოახლოვდა სასუფეველი ღვთისა; შეინანეთ და გწამდეთ სახარება.
- სიმონისა და ანდრიას, იაკობისა და იოანეს მოწოდება (მთ.4,18-22; ლკ.5,8–11)
16 და როდესაც მიდიოდა გალილეის ზღვის პირას, იხილა სიმონი და ანდრია, ძმა მისი, რომლებიც ისროდნენ ბადეს ზღვაში, რადგან იყვნენ მებადურები.
17 და უთხრა მათ იესომ: მოდით და შემომიდექით მე და გაქცევთ თქვენ კაცთა მებადურებად.
18 და მყისვე დატოვეს ბადეები და გაჰყვნენ მას.
19 და ცოტა რომ გაიარა, იხილა იაკობ ზებედესი და იოანე, ძმა მისი; ისინიც ამზადებდნენ ბადეებს ნავში.
20 და მყისვე უხმო მათ. და მათ დატოვეს თავისი მამა, ზებედე, ნავში მუშებთან და გაჰყვნენ მას,
21 და შევიდნენ კაპერნაუმში, და მაშინვე, შაბათს, შევიდა შესაკრებელში და ასწავლიდა.
22 და განცვიფრებული იყვნენ მისი მოძღვრებით, რადგან ასწავლიდა მათ, როგორც ხელმწიფების მქონე და არა როგორც მწიგნობრები.
- ეშმაკეულის განკურნება შესაკრებელში (ლკ.4,33-36)
23 და იყო მათ შესაკრებელში კაცი, არაწმინდა სულით შეპყრობილი, და შეჰყვირა
24 და თქვა: ეჰა, რა გინდა ჩვენგან შენ, იესო ნაზარეველო? მოხვედი ჩვენს წარსაწყმედად? გიცნობთ შენ, ვინ ხარ, წმიდა ღვთისა.
25 და შერისხა იგი იესომ და უთხრა გაჩუმდი და გადი მაგისგან
26 და დაანარცხა იგი არაწმინდა სულმა და იყვირა დიდი ხმით და გავიდა მისგან.
27 და გაოცდა ყველა, ისე რომ კამათობდნენ ერთმანეთში და ამბობდნენ: ვინ არის ეს? რა არის ეს ახალი მოძღვრება, რომ ხელმწიფებით არაწმინდა სულებსაც უბრძანებს და ემორჩილებიან მას?
28 და გავრცელდა მისი ამბავი მყისვე გალილეის მთელი შემოგარენში.
- სიმონის სიდედრისა და მრავალთა განკურნება (მთ.8,14-17; ლკ.4,38-41)
29 და მაშინვე გამოვიდა შესაკრებლიდან და მივიდა სიმონისა და ანდრიას სახლში. იაკობთან და იოანესთან ერთად.
30 ხოლო სიმონის სიდედრი იწვა ცხელებით და მაშინვე უთხრეს მას მის შესახებ.
31 და მივიდა და მოჰკიდა ხელი და ააყენა იგი; და მყისვე დატოვა იგი ცხელებამ და ემსახურებოდა მათ.
32 ხოლო როცა მოსაღამოვდა, მზის ჩასვლისას, მოჰყავდათ მასთან ყველა ავადმყოფი და ეშმაკეული
33 და მთელი ქალაქი შეკრებილი იყო კარების წინ.
34 და განკურნა მრავალი ავადმყოფი. სხვადასხვა სენისგან და მრავალი ეშმაკი განდევნა, და არ ანებებდა ეშმაკებს თქმას, რომ იცოდნენ, რომ იგია ქრისტე.
- იესო ქრისტეს მიერ ქადაგების დაწყება გალილეაში (ლკ.4,42-44)
35 და განთიადისას, რიჟრაჟზე, ადგა და გამოვიდა და მივიდა უდაბურ ადგილას და იქ ლოცულობდა.
36 და მისდევდნენ. მას სიმონი და ვინც მასთან იყო.
37 და იპოვეს იგი და უთხრეს მას: ყველანი გეძებენ შენ.
38 და უთხრა მათ: მოდით, წავიდეთ მახლობელ დაბა-ქალაქებში, რომ იქაც ვიქადაგო, რადგან ამისთვის მოვედი.
39 და ქადაგებდა მათ შესაკრებლებში მთელი გალილეაში და ეშმაკებს დევნიდა.
- კეთროვნის განკურნება (მთ.8,1-4; ლკ.5,12-14)
40 მივიდა მასთან კეთროვანი და ევედრებოდა მას მუხლმოდრეკილი და ეუბნებოდა: თუ გნებავს, შეგიძლია ჩემი განწმენდა,
41 ხოლო იესოს შეებრალა, გაიწოდა ხელი და შეახო მას და უთხრა: მნებავს, განიწმინდე.
42 და როდესაც ეს თქვა, მაშინვე მოშორდა მას კეთრი და განიწმინდა.
43 და მკაცრად მიმართა მას და მაშინვე გააგდო იგი
44 და უთხრა მას: იცოდე, არავის არაფერი უთხრა, არამედ წადი და უჩვენე შენი თავი მღვდელს და შესწირე შენი განწმენდისათვის, რაც ბრძანა მოსემ მათთვის დასამოწმებლად;
45 ხოლო როდესაც იგი გამოვიდა, დაიწყო ბევრი ქადაგება და გავრცელება სიტყვისა, ისე რომ აღარ შეეძლო მას ცხადად ქალაქში შესვლა, არამედ გარეთ, უდაბურ ადგილებში, იმყოფებოდა და მიდიოდნენ მასთან ყოველი მხრიდან.
480,2,0,
1 და შევიდა კვლავ კაპერნაუმში რამდენიმე დღის შემდეგ და გაიგეს, რომ სახლშია.
- დავრდომილის განკურნება კაპერნაუმში (მთ.9,1-8; ლკ.5,17-20)
2 და მაშინვე შეიკრიბნენ ბევრნი, ისე რომ აღარ იყო ტევა კარის წინაც კი, და ეუბნებოდა მათ სიტყვას.
3 და მივიდნენ მასთან და მიიყვანეს დავრდომილი, რომელიც მოჰყავდა ოთხს;
4 და რადგან ვერ შეძლეს მიახლოება მასთან ხალხის გამო, მოხადეს სახურავი სახლს, სადაც იყო იგი, გათხარეს და ჩაუშვეს საწოლი, რომელზეც იწვა დავრდომილი.
5 და იხილა იესომ მათი რწმენა და უთხრა დავრდომილს: შვილო, მოგეტეოს შენ შენი ცოდვები.
6 ხოლო იყო იქ ზოგი მწიგნობართაგანი, იჯდა და ფიქრობდა თავის გულში:
7 რად ამბობს ეს ასე? გმობს; ვის შეუძლია ცოდვების მიტევება, თუ არა მხოლოდ ღმერთს?
8 და მყისვე გულისხმაყო იესომ თავისი სულით, რომ ასე ფიქრობდნენ თავის გულში და უთხრა მათ: რად ფიქრობთ მაგას თქვენს გულში?
9 რა უფრო ადვილია, თქმა დავრდომილისთვის: მოგეტევა შენ ცოდვები, თუ თქმა: ადექი, აიღე შენი საწოლი და იარე?
10 ხოლო რათა იცოდეთ, რომ ხელმწიფება აქვს ძეს კაცისას ქვეყანაზე ცოდვების მიტევებისა, უთხრა დავრდომილს:
11 შენ გეუბნები, ადექი, აიღე შენი საწოლი და წადი შენს სახლში!
12 და ადგა და მაშინვე აიღო საწოლი და გამოვიდა ყველას წინაშე, ისე რომ გაოგნდა ყველა და ადიდებდნენ ღმერთს და ამბობდნენ: ამგვარი რამ არასოდეს გვიხილავს.
- ლევი-მათე მეზვერის მოწოდება (მთ.9,9-13; ლკ.5,27-32)
13 და გავიდა კვლავ ზღვის პირას და მთელი ხალხი მიდიოდა მასთან და ასწავლიდა მათ.
14 და როდესაც გაიარა, იხილა ლევი, ალფესი, მჯდომარე საზვერეში, და უთხრა მას: გამომყევი მე. და ადგა და გაჰყვა მას.
15 და იყო, როდესაც ინახით იჯდა იგი მის სახლში, მრავალი მეზვერე და ცოდვილი იჯდა თანამეინახედ იესოსთან და მის მოწაფეებთან, რადგან ბევრნი იყვნენ და მიჰყვებოდნენ მას.
16 და მწიგნობრებმა და ფარისევლებმა, როდესაც ნახეს იგი, რომ მეზვერეებთან და ცოდვილებთან ჭამდა, უთხრეს მის მოწაფეებს: რატომ ჭამს და სვამს მეზვერეებთან და ცოდვილებთან?
17 და გაიგონა იესომ და უთხრა მათ: არ სჭირდებათ მკურნალი ჯანმრთელებს, არამედ ავადმყოფებს; არ მოვსულვარ მოსაწოდებლად მართალთა, არამედ ცოდვილთა.
- იოანეს მოწაფეების შეკითხვა მარხვის შესახებ (მთ.9,14–17; ლკ.5,33-39)
18 და როდესაც მარხულობდნენ იოანეს და ფარისეველთა მოწაფეები, მივიდნენ და უთხრეს მას: რატომ მარხულობენ იოანეს და ფარისეველთა მოწაფეები, ხოლო შენი მოწაფეები არ მარხულობენ?
19 და უთხრა მათ იესომ: განა შეუძლიათ ქორწილის ძეებს მარხვა, ვიდრე სიძე არის მათთან? ვიდრე სიძე არის მათთან, არ შეუძლიათ მარხვა,
20 ხოლო მოვა დღეები, როცა წაიყვანენ მათგან სიძეს და მაშინ იმარხულებენ, იმ დღეებში.
21 არავინ ადებს ახალი ნაჭრის საკერებელს ძველ სამოსს, თორემ დაარღვევს ახალი ძველის მთლიანობას და უფრო დაიხევა.
22 და არავინ ასხამს ახალ ღვინოს ძველ თხიერებში, თორემ გახეთქავს ახალი ღვინო თხიერებს და ღვინო დაიღვრება და თხიერები უვარგისი გახდება, არამედ ახალ ღვინოს ახალ თხიერებში ასხამენ.
- თავთავების მოწყვეტა და სიტყვა შაბათის შესახებ (მთ.12,1-8; ლკ.6,1-5)
23 და იყო, როდესაც მიდიოდა იგი შაბათს ნათესებში, მისმა მოწაფეებმა დაიწყეს გზად თავთავების მოწყვეტა.
24 და ფარისევლები ეუბნებოდნენ მას: ნახე, იმას აკეთებენ შაბათს, რაც არ არის მართებული?
25 და მან უთხრა მათ: არასოდეს ამოგიკითხავთ, რა გააკეთა დავითმა, როდესაც დასჭირდა, როცა მოშივდათ მას და მასთან მყოფებს?
26 როგორ შევიდა ღვთის სახლში აბიათარის მღვდელმთავრობისას და შესაწირავი პურები შეჭამა, რომელთა ჭამაც არ იყო მართებული არავისთვის, მღვდლების გარდა, და მისცა იმათაც, ვინც მასთან იყო?
27 და ეუბნებოდა მათ: შაბათი კაცისათვის შეიქმნა და არა კაცი — შაბათისათვის.
28 ასე რომ, ძე კაცისა უფალი არის შაბათისაც.
480,3,0,
- გამხმარი ხელის მქონე კაცის განკურნება შესაკრებელში შაბათს (მთ.12,10-14; ლკ.6,6-11)
1 და შევიდა კვლავ შესაკრებელში; და იყო იქ კაცი, რომელსაც გამხმარი ჰქონდა ხელი.
2 და უთვალთვალებდნენ მას, შაბათს თუ განკურნავდა, რათა დაესმინათ იგი.
3 და უთხრა კაცს, რომელსაც გამხმარი ჰქონდა ხელი: ადექი და დადექი შუაში!
4 და უთხრა მათ: მართებულია შაბათს სიკეთის კეთება, თუ ბოროტების კეთება, სულის ცხონება, თუ დაღუპვა? ხოლო ისინი დუმდნენ.
5 და შეხედა მათ რისხვით და შეწუხებულმა მათი გულქვაობით, უთხრა კაცს: გაშალე შენი ხელი, და გაშალა და აღუდგა მას ხელი.
6 და როდესაც გამოვიდნენ ფარისევლები, მაშინვე ბჭობა გამართეს ჰეროდიანებთან მის წინააღმდეგ, თუ როგორ დაეღუპათ იგი;
7 ხოლო იესო თავის მოწაფეებთან ერთად გაშორდა მათ და წავიდა ზღვისკენ; და მრავალი ხალხი გაჰყვა მას გალილეიდან და ჰურიასტანიდან
8 და იერუსალიმიდან და იდუმეიდან და იორდანის გაღმიდან და ტვიროსისა და სიდონის მხარიდან; და ძალიან ბევრი, ვინც გაიგო, რასაც აკეთებდა, მივიდა მასთან.
9 და უთხრა თავის მოწაფეებს, რომ ნავი გაემზადებინათ მისთვის ხალხის გამო, რათა არ შეევიწროებინათ იგი;
10 რადგან მრავალი განკურნა, ამიტომ ზედ აწყდებოდნენ მას, რათა შეხებოდნენ, რომლებიც უძლურებაში იყვნენ.
11 და არაწმინდა სულები, როცა ხედავდნენ მას, ეცემოდნენ მის წინ, ღაღადებდნენ და ამბობდნენ: შენ ხარ ძე ღვთისა!
12 და ძლიერ გაკიცხა ისინი, რათა არ გაეცხადებინათ იგი.
- თორმეტი მოწაფის გამორჩევა სამოციქულო მოღვაწეობისთვის (მთ.10,1-4; ლკ.6,12-16)
13 და ავიდა მთაზე და მოუწოდა მათ, ვინც მას უნდოდა. და მივიდნენ მასთან.
14 და დაადგინა თორმეტი, რათა ყოფილიყვნენ მასთან და გაეგზავნა ისინი საქადაგებლად.
15 და ჰქონოდათ ხელმწიფება ეშმაკთა განდევნისა;
16 და დაარქვა სახელი სიმონს — პეტრე
17 და იაკობ ზებედესას და იოანეს, იაკობის ძმას, მათაც დაარქვა სახელები, ბანერგესი, რაც არის ძენი ქუხილისა.
18 ანდრიას და ფილიპეს, ბართლომეს და მათეს, თომას იაკობ ალფესას, თადეოზსა და სიმონ კანანელს
19 და იუდა ისკარიოტელს, რომელმაც გასცა იგი.
20 და მივიდნენ სახლში და შეიკრიბა კვლავ ხალხი, ისე რომ ვერ შეძლეს მათ პურის ჭამაც.
- მწიგნობართაგან (და ფარისეველთაგან) იესოსთვის სახელის გატეხის მცდელობის მხილება (მთ.12,24-37; ლკ-11,15-23)
